{"createdAt":"2026-10-19T04:31:50Z","elfSha256":"e6e06afd460d31db211d3eff84c031b14ebb2019b71256b651e6932e4e9c4c03","outputStateCommitment":"4783c68ffbae1b11475a009ccd421b15045287929143d0f975cb1842933d7a62","outputStateId":"S4_eval","programVKey":"0x003eba0b114a21d954c4714393c0eedf6833406b8e9b6b70ae828b3a466ea2e3","programVersion":"kryptroom-m5-evaluation-v1","proofArtifact":{"mediaType":"application/vnd.kryptroom.sp1-groth16-proof","sha256":"bfc8784ddcde6af464fecb02da33dc12642f804c28bbaa2ecca9eca37a9608bc","sizeBytes":1758,"uri":"proofs/rooms/cancer-collaboration-room/transitions/private-model-evaluation-to-S4/stateproof-b26ee61e127525ad573e889e8ea664da/proof.bin"},"proofId":"stateproof-b26ee61e127525ad573e889e8ea664da","proofSystem":"sp1-groth16","proofSystemVersion":"6.9.0","publicValuesSha256":"f3a01116979ac92283e09da5c1eca9b3a4c17d2f11f14cb900ddbb9d6c050de1","receiptHash":"efb5f78f465add31f5161213b21eda4a271a52c7bc2f063709355ce6cc02e1d8","roomId":"cancer-collaboration-room","transitionCommitment":"1283c79f6f9cd06e7f538bb7d9ed33594d0bd319988848bd93723a24b702f68f","transitionId":"private-model-evaluation-to-S4","version":"1"}
